[
  {
    "year": 1600,
    "date": "10 Apr",
    "type": "",
    "groom_forename": "William",
    "groom_surname": "Perslowe",
    "groom_age": "",
    "groom_condition": "",
    "groom_occupation": "",
    "groom_residence": "",
    "bride_forename": "Alice",
    "bride_surname": "Pemmerton",
    "bride_age": "",
    "bride_condition": "",
    "bride_occupation": "",
    "bride_residence": "",
    "notes": "Martin WRIGHT Vicar"
  },
  {
    "year": 1602,
    "date": "21 Oct",
    "type": "",
    "groom_forename": "Henry",
    "groom_surname": "Newett",
    "groom_age": "",
    "groom_condition": "",
    "groom_occupation": "",
    "groom_residence": "",
    "bride_forename": "Elizabeth",
    "bride_surname": "Walker",
    "bride_age": "",
    "bride_condition": "",
    "bride_occupation": "",
    "bride_residence": "",
    "notes": ""
  },
  {
    "year": 1606,
    "date": "20 Oct",
    "type": "",
    "groom_forename": "William",
    "groom_surname": "Dorrell",
    "groom_age": "",
    "groom_condition": "",
    "groom_occupation": "",
    "groom_residence": "",
    "bride_forename": "Dorithie",
    "bride_surname": "Walton",
    "bride_age": "",
    "bride_condition": "",
    "bride_occupation": "",
    "bride_residence": "",
    "notes": ""
  },
  {
    "year": 1607,
    "date": "3 Aug",
    "type": "",
    "groom_forename": "Edward",
    "groom_surname": "Growte",
    "groom_age": "",
    "groom_condition": "",
    "groom_occupation": "",
    "groom_residence": "",
    "bride_forename": "Alice",
    "bride_surname": "Dorrell",
    "bride_age": "",
    "bride_condition": "",
    "bride_occupation": "",
    "bride_residence": "",
    "notes": ""
  },
  {
    "year": 1610,
    "date": "30 Sep",
    "type": "",
    "groom_forename": "Thomas",
    "groom_surname": "Huffer",
    "groom_age": "",
    "groom_condition": "",
    "groom_occupation": "",
    "groom_residence": "",
    "bride_forename": "Sibil",
    "bride_surname": "Heaks",
    "bride_age": "",
    "bride_condition": "",
    "bride_occupation": "",
    "bride_residence": "",
    "notes": ""
  },
  {
    "year": 1610,
    "date": "25 Nov",
    "type": "",
    "groom_forename": "Francis",
    "groom_surname": "Hawes",
    "groom_age": "",
    "groom_condition": "",
    "groom_occupation": "",
    "groom_residence": "",
    "bride_forename": "Anne",
    "bride_surname": "Walter",
    "bride_age": "",
    "bride_condition": "",
    "bride_occupation": "",
    "bride_residence": "",
    "notes": ""
  },
  {
    "year": 1610,
    "date": "14 Jan",
    "type": "",
    "groom_forename": "Walter",
    "groom_surname": "Byrde",
    "groom_age": "",
    "groom_condition": "",
    "groom_occupation": "",
    "groom_residence": "",
    "bride_forename": "Jane",
    "bride_surname": "Walter",
    "bride_age": "",
    "bride_condition": "",
    "bride_occupation": "",
    "bride_residence": "",
    "notes": ""
  },
  {
    "year": 1615,
    "date": "6 Aug",
    "type": "",
    "groom_forename": "Jonas",
    "groom_surname": "Humphrie",
    "groom_age": "",
    "groom_condition": "",
    "groom_occupation": "",
    "groom_residence": "",
    "bride_forename": "Elizabeth",
    "bride_surname": "Dossett",
    "bride_age": "",
    "bride_condition": "",
    "bride_occupation": "",
    "bride_residence": "",
    "notes": "Thomas VAUDREY Vicar"
  },
  {
    "year": 1615,
    "date": "10 Aug",
    "type": "",
    "groom_forename": "William",
    "groom_surname": "Wade",
    "groom_age": "",
    "groom_condition": "",
    "groom_occupation": "",
    "groom_residence": "",
    "bride_forename": "Mabell",
    "bride_surname": "Robbins",
    "bride_age": "",
    "bride_condition": "",
    "bride_occupation": "",
    "bride_residence": "",
    "notes": ""
  },
  {
    "year": 1618,
    "date": "6 Feb",
    "type": "",
    "groom_forename": "Henrie",
    "groom_surname": "Robinson",
    "groom_age": "",
    "groom_condition": "",
    "groom_occupation": "",
    "groom_residence": "",
    "bride_forename": "Marie",
    "bride_surname": "Dorrell",
    "bride_age": "",
    "bride_condition": "",
    "bride_occupation": "",
    "bride_residence": "",
    "notes": ""
  },
  {
    "year": 1619,
    "date": "28 Oct",
    "type": "",
    "groom_forename": "Edmund",
    "groom_surname": "Androse",
    "groom_age": "",
    "groom_condition": "",
    "groom_occupation": "",
    "groom_residence": "",
    "bride_forename": "Elizabeth",
    "bride_surname": "Eversley",
    "bride_age": "",
    "bride_condition": "",
    "bride_occupation": "",
    "bride_residence": "",
    "notes": ""
  },
  {
    "year": 1619,
    "date": "26 Jan",
    "type": "",
    "groom_forename": "William",
    "groom_surname": "Dorrell",
    "groom_age": "",
    "groom_condition": "",
    "groom_occupation": "",
    "groom_residence": "",
    "bride_forename": "Anne",
    "bride_surname": "Dorrell",
    "bride_age": "",
    "bride_condition": "",
    "bride_occupation": "",
    "bride_residence": "",
    "notes": ""
  },
  {
    "year": 1620,
    "date": "18 May",
    "type": "",
    "groom_forename": "John",
    "groom_surname": "Walter",
    "groom_age": "",
    "groom_condition": "",
    "groom_occupation": "",
    "groom_residence": "",
    "bride_forename": "Alse",
    "bride_surname": "Hardinge",
    "bride_age": "",
    "bride_condition": "",
    "bride_occupation": "",
    "bride_residence": "",
    "notes": ""
  },
  {
    "year": 1620,
    "date": "3 Jul",
    "type": "",
    "groom_forename": "Edmund",
    "groom_surname": "Dorrell",
    "groom_age": "",
    "groom_condition": "",
    "groom_occupation": "",
    "groom_residence": "",
    "bride_forename": "Amye",
    "bride_surname": "Huuse",
    "bride_age": "",
    "bride_condition": "",
    "bride_occupation": "",
    "bride_residence": "",
    "notes": ""
  },
  {
    "year": 1620,
    "date": "30 Sep",
    "type": "",
    "groom_forename": "Henrie",
    "groom_surname": "Wright",
    "groom_age": "",
    "groom_condition": "",
    "groom_occupation": "",
    "groom_residence": "",
    "bride_forename": "Dorrothea",
    "bride_surname": "Pullin",
    "bride_age": "",
    "bride_condition": "",
    "bride_occupation": "",
    "bride_residence": "",
    "notes": ""
  },
  {
    "year": 1623,
    "date": "26 Jul",
    "type": "",
    "groom_forename": "Thomas",
    "groom_surname": "Raunce",
    "groom_age": "",
    "groom_condition": "",
    "groom_occupation": "",
    "groom_residence": "",
    "bride_forename": "Elizabeth",
    "bride_surname": "Walter",
    "bride_age": "",
    "bride_condition": "",
    "bride_occupation": "",
    "bride_residence": "",
    "notes": ""
  },
  {
    "year": 1623,
    "date": "5 Dec",
    "type": "",
    "groom_forename": "Henrie",
    "groom_surname": "Bampton",
    "groom_age": "",
    "groom_condition": "",
    "groom_occupation": "",
    "groom_residence": "",
    "bride_forename": "Marie",
    "bride_surname": "Hayley",
    "bride_age": "",
    "bride_condition": "",
    "bride_occupation": "",
    "bride_residence": "",
    "notes": ""
  },
  {
    "year": 1626,
    "date": "1 May",
    "type": "",
    "groom_forename": "James",
    "groom_surname": "Smyth",
    "groom_age": "",
    "groom_condition": "",
    "groom_occupation": "",
    "groom_residence": "",
    "bride_forename": "Alse",
    "bride_surname": "Tyler",
    "bride_age": "",
    "bride_condition": "",
    "bride_occupation": "",
    "bride_residence": "",
    "notes": ""
  },
  {
    "year": 1630,
    "date": "13 Jan",
    "type": "",
    "groom_forename": "Thomas",
    "groom_surname": "Hebborne",
    "groom_age": "",
    "groom_condition": "",
    "groom_occupation": "",
    "groom_residence": "",
    "bride_forename": "Joane",
    "bride_surname": "Gemmett",
    "bride_age": "",
    "bride_condition": "",
    "bride_occupation": "",
    "bride_residence": "",
    "notes": ""
  },
  {
    "year": 1632,
    "date": "6 Aug",
    "type": "",
    "groom_forename": "Christopher",
    "groom_surname": "Brookes",
    "groom_age": "",
    "groom_condition": "",
    "groom_occupation": "",
    "groom_residence": "",
    "bride_forename": "Isabel",
    "bride_surname": "Chitches",
    "bride_age": "",
    "bride_condition": "",
    "bride_occupation": "",
    "bride_residence": "",
    "notes": ""
  },
  {
    "year": 1633,
    "date": "11 Nov",
    "type": "",
    "groom_forename": "Thomas",
    "groom_surname": "Gomm",
    "groom_age": "",
    "groom_condition": "",
    "groom_occupation": "",
    "groom_residence": "",
    "bride_forename": "Ursula",
    "bride_surname": "Stevens",
    "bride_age": "",
    "bride_condition": "",
    "bride_occupation": "",
    "bride_residence": "",
    "notes": ""
  },
  {
    "year": 1633,
    "date": "13 Feb",
    "type": "",
    "groom_forename": "John",
    "groom_surname": "Brookes",
    "groom_age": "",
    "groom_condition": "",
    "groom_occupation": "",
    "groom_residence": "",
    "bride_forename": "Maria",
    "bride_surname": "Quatermaine",
    "bride_age": "",
    "bride_condition": "",
    "bride_occupation": "",
    "bride_residence": "",
    "notes": "Licence"
  },
  {
    "year": 1637,
    "date": "30 Nov",
    "type": "",
    "groom_forename": "Richard",
    "groom_surname": "Big",
    "groom_age": "",
    "groom_condition": "",
    "groom_occupation": "",
    "groom_residence": "",
    "bride_forename": "Margarett",
    "bride_surname": "Trip",
    "bride_age": "",
    "bride_condition": "",
    "bride_occupation": "",
    "bride_residence": "",
    "notes": "d of John & Hellen"
  },
  {
    "year": 1659,
    "date": "13 Feb",
    "type": "",
    "groom_forename": "Thomas",
    "groom_surname": "Bowler",
    "groom_age": "",
    "groom_condition": "",
    "groom_occupation": "",
    "groom_residence": "",
    "bride_forename": "Jane",
    "bride_surname": "Bowler",
    "bride_age": "",
    "bride_condition": "",
    "bride_occupation": "",
    "bride_residence": "",
    "notes": ""
  },
  {